{
  "intent_id": "a1b2c3d4-e5f6-7890-abcd-ef1234567890",
  "payer_user_id": "usr_7f3a9b2c1d4e5f6a",
  "target_type": "SUBSCRIPTION",
  "target_id": "sub_2e4d6f8a0b1c3e5f",
  "field_id": "f47ac10b-58cc-4372-a567-0e02b2c3d479",
  "amount_kurus": 2000,
  "currency": "TRY",
  "method": "IBAN_TRANSFER",
  "status": "PAYMENT_PENDING",
  "price_snapshot_id": "snap_v1_cotton_seasonal_20260220",
  "receipt_blob_id": null,
  "payment_provider_ref": null,
  "rejection_reason": null,
  "admin_note": null,
  "admin_user_id": null,
  "paid_at": null,
  "rejected_at": null,
  "cancelled_at": null,
  "refunded_at": null,
  "created_at": "2026-02-24T10:30:00Z",
  "updated_at": null,
  "correlation_id": "corr_20260224_a1b2c3d4"
}
