{
  "intent_id": "b2c3d4e5-f6a7-8901-bcde-f12345678901",
  "payer_user_id": "usr_3a5b7c9d1e2f4a6b",
  "target_type": "MISSION",
  "target_id": "msn_9d8c7b6a5e4f3d2c",
  "field_id": "c58bd21a-69dd-5483-b678-1f13c3d4e580",
  "amount_kurus": 2500,
  "currency": "TRY",
  "method": "CREDIT_CARD",
  "status": "PAID",
  "price_snapshot_id": "snap_v1_cotton_single_20260220",
  "receipt_blob_id": null,
  "payment_provider_ref": "pay_iyzico_TXN20260224_9a8b7c",
  "rejection_reason": null,
  "admin_note": null,
  "admin_user_id": null,
  "paid_at": "2026-02-24T11:02:30Z",
  "rejected_at": null,
  "cancelled_at": null,
  "refunded_at": null,
  "created_at": "2026-02-24T11:00:00Z",
  "updated_at": "2026-02-24T11:02:30Z",
  "correlation_id": "corr_20260224_b2c3d4e5"
}
